### ISSUE TITLE
Cannot connect to websocketpp server when ufw firewall is installed

### ISSUE THREAD

**Issue by tkarls** [zaphoyd/websocketpp#623]
And no, I have not blocked the port :)
Even if I disable the firewall I cannot connect until I reboot the computer. Restarting the app  does not help. Although other apps using boost asio directly or zmq works just fine.

I made a post on stack overflow  but since I believe the issue must be related to websocketpp and boost asio somehow I post here too

I am using the echo server in the example directory for my tests.

Check that my app is listen on port 9002:
```
sudo netstat -lnp | grep 900
tcp6       0      0 :::9002                 :::*                    LISTEN      12695/./bin/echo_se 
```

Output from the echo server with debug
```
[2017-03-09 11:38:06] [devel] endpoint constructor
[2017-03-09 11:38:06] [devel] server constructor
[2017-03-09 11:38:06] [devel] asio::init_asio
[2017-03-09 11:38:06] [devel] set_message_handler
[2017-03-09 11:38:06] [devel] asio::listen
[2017-03-09 11:38:06] [devel] create_connection
[2017-03-09 11:38:06] [devel] asio con transport constructor
[2017-03-09 11:38:06] [devel] connection constructor
[2017-03-09 11:38:06] [devel] transport::asio::init
[2017-03-09 11:38:06] [devel] asio::async_accept
```

Output from telnet (since I only care about the tcp handshake at this point

```
telnet localhost 9002
Trying ::1...
(eventually timeout)
```

And If I close the echo server so no app is listening any more. Then I get (as expected)

```
telnet localhost 9002
Trying ::1...
Connection failed: Connection refused
Trying 127.0.0.1...
telnet: Unable to connect to remote host: Connection refused
```

So, now the OS notice that no one is listening and sends connection refused.
I mean. This tells me that the traffic is not blocked and that the application has successfully made bind and listen. So why doesn't it work?

For completeness. After disabling ufw and rebooting the echo server prints this

```
2017-03-09 11:49:17] [devel] endpoint constructor
[2017-03-09 11:49:17] [devel] server constructor
[2017-03-09 11:49:17] [devel] asio::init_asio
[2017-03-09 11:49:17] [devel] set_message_handler
[2017-03-09 11:49:17] [devel] asio::listen
[2017-03-09 11:49:17] [devel] create_connection
[2017-03-09 11:49:17] [devel] asio con transport constructor
[2017-03-09 11:49:17] [devel] connection constructor
[2017-03-09 11:49:17] [devel] transport::asio::init
[2017-03-09 11:49:17] [devel] asio::async_accept
[2017-03-09 11:49:23] [devel] asio::handle_accept
[2017-03-09 11:49:23] [devel] connection start
[2017-03-09 11:49:23] [devel] asio connection init
[2017-03-09 11:49:23] [devel] asio connection handle pre_init
[2017-03-09 11:49:23] [devel] asio connection post_init
[2017-03-09 11:49:23] [devel] asio connection handle_post_init
[2017-03-09 11:49:23] [devel] connection handle_transport_init
[2017-03-09 11:49:23] [devel] connection read_handshake
[2017-03-09 11:49:23] [devel] asio async_read_at_least: 1
[2017-03-09 11:49:23] [devel] create_connection
[2017-03-09 11:49:23] [devel] asio con transport constructor
[2017-03-09 11:49:23] [devel] connection constructor
[2017-03-09 11:49:23] [devel] transport::asio::init
[2017-03-09 11:49:23] [devel] asio::async_accept
[2017-03-09 11:49:23] [devel] asio post init timer cancelled
```

and telnet this:

```
telnet localhost 9002
Trying ::1...
Connected to localhost.
Escape character is '^]'.
Connection closed by foreign host.
```

So then everything works perfekt!

And "after sudo ufw enable && sudo ufw disable" it does not work any more...

Also see:
http://stackoverflow.com/questions/42693473/issue-with-accepting-connection-using-websocketpp-with-firewall-enabled

I also tried  to compile the lib with standalone ASIO but it is the same...

Any help appreciated. Is it a way to make websocketpp sever even more minimal to try and find something that works?

**Comment by zaphoyd** [comment]
Also can you provide a bit more information about the environment? In particular, what OS, what version of boost, what compiler, are you connecting over localhost/the loopback, are there any other non-standard network settings involved (NATs, IPv6 status, etc)?

**Comment by tkarls** [comment]
Thanks for your reply. I will try the example you point out. I'll get back to you soon.

I'm using arch linux with packages up to date as of 2017-03-09 (4.9.11-1-ARCH)
gcc version 6.3.1 20170109 (GCC)
boost 1.63.0-1
boost-libs 1.63.0-1

I'm trying both over localhost / 127.0.0.1 and from remote ip. Same behavior.
No strange ip settings as far as I can tell. I'm using systemd-networkd to manage the network and it's a standard dhcp setup. No nat. Haven't touched any ipv6 settings.


I also tried this just now. In the echo_server example I kept all the includes and everything but changed the main function into this (which basically is the smallest io_server example I could come up with):

```
namespace ba = boost::asio;
using boost::asio::ip::tcp;

void handle_accept(const boost::system::error_code& error){
        printf("accepted\n");
}

int main() {

        ba::io_service io_service;
        tcp::socket s(io_service);
        tcp::acceptor acceptor(io_service, tcp::endpoint(tcp::v6(), 9002));

        acceptor.async_accept(s,&handle_accept);

        io_service.run();
}
```

And, yes. With this code I get "accepted" printed and telnet print "connected to..."

**Comment by tkarls** [comment]
Ok, so I cloned the asio project https://github.com/chriskohlhoff/asio/ and built the master branch.

Then started the webserver app with:
`/http_server 0.0.0.0 9002 .`

Then tested from localhost with curl:

```
curl localhost:9002/main.cpp
//
// main.cpp
// ~~~~~~~~
//
// Copyright (c) 2003-2016 Christopher M. Kohlhoff (chris at kohlhoff dot com)
//
....
```

also tested via webrowser on another computer and that worked too.

So, out of the box asio seem to work just fine.

I must say that this looks like a complete mystery...

**Comment by zaphoyd** [comment]
Alright, thats a pretty standard arrangement that should work. I vaguely recall an issue similar to this... trying to remember where..

I know I've found issues with certain types of state-full firewalls and IDS/IPS, especially those that buffer data or make assumptions about HTTP connections that aren't true for WebSockets. Things like the handshake getting stuck in a buffer forever or failing a security check and being silently dropped. I'm not aware of ufw/iptables doing anything that invasive though..  I wonder if there is anything in the ufw/iptables logs that might say why the connection is being dropped?

The debug log you included indicates that WebSocket++ is never even having handle_accept called. It is clearly being called in your simpler example. Mildly curious what happens if you run your simplest tcp server example and try making a websocket connection to it.

**Comment by tkarls** [comment]
Yea I would have better understood/accepted the problem it if there was a problem with the ws handshake or when sending/receiving ws data. Now the problem looks like it is one level below that.

I spend the better part of yesterday trying to figure out why the packages were dropped by ufw. But the thing is. I don't think ufw are dropping them. Since IF ufw/iptables was dropping the packages then I would get the same behavior with the websocket server or not. With the app stopped the OS should never get the traffic and never report "connection refused".

Also, the simple example, on the same port, would not work.

Although, clearly something happen when installing ufw as everything works fine without it being present. But it only affects websocketpp applications (if I didn't have the problem in front of me I would not believe it my self).

Yesterday I also enabled loggin of all packets to port 7260 and 7262 (this was to my real app. on 7260 I listen on a zmq socket and on 7262 I listen on a websocketpp socket) to try and find out why iptables was dropping the package. And the trace looked identical, but the websocket port never connected...

tcp connect to zmq socket
```
Mar 08 16:50:20 headend-b kernel: TRACE: filter:ufw-user-input:rule:7 IN=ens192 OUT= MAC=00:0c:29:c6:b4:a1:08:00:27:ff:b1:dd:08:00 SRC=192.168.10.176 DST=192.168.10.185 LEN=60 TOS=0x00 PREC=0x00 TTL=64 ID=20260 DF PROTO=TCP SPT=35132 DPT=7260 SEQ=2247089343 ACK=0 WINDOW=29200 RES=0x00 SYN URGP=0 OPT (020405B40402080A0388939B0000000001030307) 
Mar 08 16:50:20 headend-b kernel: TRACE: filter:ufw-before-input:rule:14 IN=ens192 OUT= MAC=00:0c:29:c6:b4:a1:08:00:27:ff:b1:dd:08:00 SRC=192.168.10.176 DST=192.168.10.185 LEN=60 TOS=0x00 PREC=0x00 TTL=64 ID=20260 DF PROTO=TCP SPT=35132 DPT=7260 SEQ=2247089343 ACK=0 WINDOW=29200 RES=0x00 SYN URGP=0 OPT (020405B40402080A0388939B0000000001030307) 
Mar 08 16:50:20 headend-b kernel: TRACE: filter:ufw-not-local:rule:1 IN=ens192 OUT= MAC=00:0c:29:c6:b4:a1:08:00:27:ff:b1:dd:08:00 SRC=192.168.10.176 DST=192.168.10.185 LEN=60 TOS=0x00 PREC=0x00 TTL=64 ID=20260 DF PROTO=TCP SPT=35132 DPT=7260 SEQ=2247089343 ACK=0 WINDOW=29200 RES=0x00 SYN URGP=0 OPT (020405B40402080A0388939B0000000001030307) 
Mar 08 16:50:20 headend-b kernel: TRACE: filter:ufw-before-input:rule:11 IN=ens192 OUT= MAC=00:0c:29:c6:b4:a1:08:00:27:ff:b1:dd:08:00 SRC=192.168.10.176 DST=192.168.10.185 LEN=60 TOS=0x00 PREC=0x00 TTL=64 ID=20260 DF PROTO=TCP SPT=35132 DPT=7260 SEQ=2247089343 ACK=0 WINDOW=29200 RES=0x00 SYN URGP=0 OPT (020405B40402080A0388939B0000000001030307) 
Mar 08 16:50:20 headend-b kernel: TRACE: filter:INPUT:rule:2 IN=ens192 OUT= MAC=00:0c:29:c6:b4:a1:08:00:27:ff:b1:dd:08:00 SRC=192.168.10.176 DST=192.168.10.185 LEN=60 TOS=0x00 PREC=0x00 TTL=64 ID=20260 DF PROTO=TCP SPT=35132 DPT=7260 SEQ=2247089343 ACK=0 WINDOW=29200 RES=0x00 SYN URGP=0 OPT (020405B40402080A0388939B0000000001030307) 
Mar 08 16:50:20 headend-b kernel: TRACE: filter:ufw-before-logging-input:return:1 IN=ens192 OUT= MAC=00:0c:29:c6:b4:a1:08:00:27:ff:b1:dd:08:00 SRC=192.168.10.176 DST=192.168.10.185 LEN=60 TOS=0x00 PREC=0x00 TTL=64 ID=20260 DF PROTO=TCP SPT=35132 DPT=7260 SEQ=2247089343 ACK=0 WINDOW=29200 RES=0x00 SYN URGP=0 OPT (020405B40402080A0388939B0000000001030307) 
Mar 08 16:50:20 headend-b kernel: TRACE: filter:INPUT:rule:1 IN=ens192 OUT= MAC=00:0c:29:c6:b4:a1:08:00:27:ff:b1:dd:08:00 SRC=192.168.10.176 DST=192.168.10.185 LEN=60 TOS=0x00 PREC=0x00 TTL=64 ID=20260 DF PROTO=TCP SPT=35132 DPT=7260 SEQ=2247089343 ACK=0 WINDOW=29200 RES=0x00 SYN URGP=0 OPT (020405B40402080A0388939B0000000001030307) 
Mar 08 16:50:20 headend-b kernel: TRACE: raw:PREROUTING:policy:3 IN=ens192 OUT= MAC=00:0c:29:c6:b4:a1:08:00:27:ff:b1:dd:08:00 SRC=192.168.10.176 DST=192.168.10.185 LEN=60 TOS=0x00 PREC=0x00 TTL=64 ID=20260 DF PROTO=TCP SPT=35132 DPT=7260 SEQ=2247089343 ACK=0 WINDOW=29200 RES=0x00 SYN URGP=0 OPT (020405B40402080A0388939B0000000001030307) 
```

tcp connect to websocketcpp socket
```
Mar 08 16:46:13 headend-b kernel: TRACE: filter:ufw-user-input:rule:7 IN=ens192 OUT= MAC=00:0c:29:c6:b4:a1:08:00:27:ff:b1:dd:08:00 SRC=192.168.10.176 DST=192.168.10.185 LEN=60 TOS=0x00 PREC=0x00 TTL=64 ID=12514 DF PROTO=TCP SPT=49254 DPT=7262 SEQ=3621470487 ACK=0 WINDOW=29200 RES=0x00 SYN URGP=0 OPT (020405B40402080A038771F50000000001030307) 
Mar 08 16:46:13 headend-b kernel: TRACE: filter:ufw-before-input:rule:14 IN=ens192 OUT= MAC=00:0c:29:c6:b4:a1:08:00:27:ff:b1:dd:08:00 SRC=192.168.10.176 DST=192.168.10.185 LEN=60 TOS=0x00 PREC=0x00 TTL=64 ID=12514 DF PROTO=TCP SPT=49254 DPT=7262 SEQ=3621470487 ACK=0 WINDOW=29200 RES=0x00 SYN URGP=0 OPT (020405B40402080A038771F50000000001030307) 
Mar 08 16:46:13 headend-b kernel: TRACE: filter:ufw-not-local:rule:1 IN=ens192 OUT= MAC=00:0c:29:c6:b4:a1:08:00:27:ff:b1:dd:08:00 SRC=192.168.10.176 DST=192.168.10.185 LEN=60 TOS=0x00 PREC=0x00 TTL=64 ID=12514 DF PROTO=TCP SPT=49254 DPT=7262 SEQ=3621470487 ACK=0 WINDOW=29200 RES=0x00 SYN URGP=0 OPT (020405B40402080A038771F50000000001030307) 
Mar 08 16:46:13 headend-b kernel: TRACE: filter:ufw-before-input:rule:11 IN=ens192 OUT= MAC=00:0c:29:c6:b4:a1:08:00:27:ff:b1:dd:08:00 SRC=192.168.10.176 DST=192.168.10.185 LEN=60 TOS=0x00 PREC=0x00 TTL=64 ID=12514 DF PROTO=TCP SPT=49254 DPT=7262 SEQ=3621470487 ACK=0 WINDOW=29200 RES=0x00 SYN URGP=0 OPT (020405B40402080A038771F50000000001030307) 
Mar 08 16:46:13 headend-b kernel: TRACE: filter:INPUT:rule:2 IN=ens192 OUT= MAC=00:0c:29:c6:b4:a1:08:00:27:ff:b1:dd:08:00 SRC=192.168.10.176 DST=192.168.10.185 LEN=60 TOS=0x00 PREC=0x00 TTL=64 ID=12514 DF PROTO=TCP SPT=49254 DPT=7262 SEQ=3621470487 ACK=0 WINDOW=29200 RES=0x00 SYN URGP=0 OPT (020405B40402080A038771F50000000001030307) 
Mar 08 16:46:13 headend-b kernel: TRACE: filter:ufw-before-logging-input:return:1 IN=ens192 OUT= MAC=00:0c:29:c6:b4:a1:08:00:27:ff:b1:dd:08:00 SRC=192.168.10.176 DST=192.168.10.185 LEN=60 TOS=0x00 PREC=0x00 TTL=64 ID=12514 DF PROTO=TCP SPT=49254 DPT=7262 SEQ=3621470487 ACK=0 WINDOW=29200 RES=0x00 SYN URGP=0 OPT (020405B40402080A038771F50000000001030307) 
Mar 08 16:46:13 headend-b kernel: TRACE: filter:INPUT:rule:1 IN=ens192 OUT= MAC=00:0c:29:c6:b4:a1:08:00:27:ff:b1:dd:08:00 SRC=192.168.10.176 DST=192.168.10.185 LEN=60 TOS=0x00 PREC=0x00 TTL=64 ID=12514 DF PROTO=TCP SPT=49254 DPT=7262 SEQ=3621470487 ACK=0 WINDOW=29200 RES=0x00 SYN URGP=0 OPT (020405B40402080A038771F50000000001030307) 
Mar 08 16:46:13 headend-b kernel: TRACE: raw:PREROUTING:policy:2 IN=ens192 OUT= MAC=00:0c:29:c6:b4:a1:08:00:27:ff:b1:dd:08:00 SRC=192.168.10.176 DST=192.168.10.185 LEN=60 TOS=0x00 PREC=0x00 TTL=64 ID=12514 DF PROTO=TCP SPT=49254 DPT=7262 SEQ=3621470487 ACK=0 WINDOW=29200 RES=0x00 SYN URGP=0 OPT (020405B40402080A038771F50000000001030307) 
```

This was done from a remote computer and both end with user-input-rule-7 as the last rule that ip tables put the package through and that rule was an ALLOW rule for tcp 7000:8000



I just created some tcp dump logs. Showing that with the simple example the tcp handshake is performed.

```
sudo tcpdump port 9002
tcpdump: verbose output suppressed, use -v or -vv for full protocol decode
listening on ens192, link-type EN10MB (Ethernet), capture size 262144 bytes
15:00:37.087690 IP thomasArchBuildVm.local.50518 > headend-b.local.dynamid: Flags [S], seq 3556288236, win 29200, options [mss 1460,sackOK,TS val 83227304 ecr 0,nop,wscale 7], length 0
15:00:37.087764 IP headend-b.local.dynamid > thomasArchBuildVm.local.50518: Flags [S.], seq 2727827872, ack 3556288237, win 28960, options [mss 1460,sackOK,TS val 3392824 ecr 83227304,nop,wscale 7], length 0
15:00:37.087980 IP thomasArchBuildVm.local.50518 > headend-b.local.dynamid: Flags [.], ack 1, win 229, options [nop,nop,TS val 83227305 ecr 3392824], length 0
15:00:37.088803 IP headend-b.local.dynamid > thomasArchBuildVm.local.50518: Flags [F.], seq 1, ack 1, win 227, options [nop,nop,TS val 3392824 ecr 83227305], length 0
15:00:37.089054 IP thomasArchBuildVm.local.50518 > headend-b.local.dynamid: Flags [F.], seq 1, ack 2, win 229, options [nop,nop,TS val 83227305 ecr 3392824], length 0
15:00:37.089097 IP headend-b.local.dynamid > thomasArchBuildVm.local.50518: Flags [.], ack 2, win 227, options [nop,nop,TS val 3392824 ecr 83227305], length 0
```

As where with the normal echo_server example there is never any ack sent from the server so the tcp handshake is not completed. we only get repeated SYN from client

```
sudo tcpdump port 9002
tcpdump: verbose output suppressed, use -v or -vv for full protocol decode
listening on ens192, link-type EN10MB (Ethernet), capture size 262144 bytes
15:02:35.291760 IP thomasArchBuildVm.local.50524 > headend-b.local.dynamid: Flags [S], seq 576160417, win 29200, options [mss 1460,sackOK,TS val 83262766 ecr 0,nop,wscale 7], length 0
15:02:36.311643 IP thomasArchBuildVm.local.50524 > headend-b.local.dynamid: Flags [S], seq 576160417, win 29200, options [mss 1460,sackOK,TS val 83263072 ecr 0,nop,wscale 7], length 0
15:02:38.338769 IP thomasArchBuildVm.local.50524 > headend-b.local.dynamid: Flags [S], seq 576160417, win 29200, options [mss 1460,sackOK,TS val 83263680 ecr 0,nop,wscale 7], length 0
```

**Comment by tkarls** [comment]
I mean this last logs from tcpdump explains why the websocketpp accept handler never gets called. There is no socket to accept yet since the tcp handshake is not performed. But why isn't the handshake performed? It should be handled by the tcp stack in the OS, right?

My gut is telling me that some parameter that websocketpp is setting up boost asio with is affecting this. But not sure which one or why it would happen.

**Comment by zaphoyd** [comment]
o.O   Yes, I agree the next place to look is to better replicate the socket settings WS++ is using.

So if this is happening with the standard echo server example.. No TLS involved.. here is a rough sketch of the Asio based setup for a WS++ server:

```
lib::asio::error_code bec;
m_io_service = lib::unique_ptr<lib::asio::io_service> service(new lib::asio::io_service());
m_acceptor = lib::make_shared<lib::asio::ip::tcp::acceptor>(lib::ref(*m_io_service));
lib::asio::ip::tcp::endpoint ep(internet_protocol, port);

m_acceptor->open(ep.protocol(),bec);
if (!bec) {
    // default is false, and default is used for echo_server
    m_acceptor->set_option(lib::asio::socket_base::reuse_address(m_reuse_addr),bec);
}
if (!bec) {
     m_acceptor->bind(ep,bec);
}
if (!bec) {
    // default is lib::asio::socket_base::max_connections
    // this setting has caused problems in the past
     m_acceptor->listen(m_listen_backlog,bec);
}
 if (bec) {
    if (m_acceptor->is_open()) {
        m_acceptor->close();
    }
}
m_acceptor->async_accept(
    con->get_raw_socket(),
        con->get_strand()->wrap(lib::bind(
            &type::handle_accept,
             this,
             callback,
             lib::placeholders::_1
        ))
    );

handle_accept(...) {
   // never gets called
}
```

the differences amount to..
- using shared/unique pointers (unlikely to be an issue)
- using the methods that return error codes rather than exceptions (unlikely to be an issue)
- explicitly setting reuse_address socket option to false (the default) (probably not an issue but does involve mucking with the settings that the OS sees so should test)
- calling open/bind/listen explicitly before calling async_accept
- calling listen with a specific backlog setting (the echo_server should be calling listen with the asio supplied default value for listen backlog, **BUT this has caused issues in the past** mostly on BSD, it might be worth playing around with different values here. 0 I know has caused strange problems in the past.) 
- async accept vs sync accept
- wrapping the accept in a strand vs not (this really should have no effect on OS level operations)

The first thing I'd test is the reuse address socket option and listen backlog as they are the easiest to test and most likely to cause problems that would be visible to the OS

**Comment by tkarls** [comment]
Ok, I might actually have something to go on now.

I decided to investigate the "different parameters" further and used strace to trace all system calls from the app (good thing about hard to find errors is that you get a crash course in linux debugging :) ).

Here are the relevant parts for the echo_server

```
socket(AF_INET6, SOCK_STREAM, IPPROTO_TCP) = 6
epoll_ctl(4, EPOLL_CTL_ADD, 6, {EPOLLIN|EPOLLPRI|EPOLLERR|EPOLLHUP|EPOLLET, {u32=23901424, u64=23901424}}) = 0
setsockopt(6, SOL_SOCKET, SO_REUSEADDR, [0], 4) = 0
bind(6, {sa_family=AF_INET6, sin6_port=htons(9002), inet_pton(AF_INET6, "::", &sin6_addr), sin6_flowinfo=htonl(0), sin6_scope_id=0}, 28) = 0
listen(6, 0)                            = 0
ioctl(6, FIONBIO, [1])                  = 0
epoll_ctl(4, EPOLL_CTL_MOD, 6, {EPOLLIN|EPOLLPRI|EPOLLERR|EPOLLHUP|EPOLLET, {u32=23901424, u64=23901424}}) = 0
epoll_wait(4, [{EPOLLIN, {u32=23901256, u64=23901256}}], 128, -1) = 1
```

And for my simple example
```
socket(AF_INET6, SOCK_STREAM, IPPROTO_TCP) = 6
epoll_ctl(4, EPOLL_CTL_ADD, 6, {EPOLLIN|EPOLLPRI|EPOLLERR|EPOLLHUP|EPOLLET, {u32=14864320, u64=14864320}}) = 0
setsockopt(6, SOL_SOCKET, SO_REUSEADDR, [1], 4) = 0
bind(6, {sa_family=AF_INET6, sin6_port=htons(9002), inet_pton(AF_INET6, "::", &sin6_addr), sin6_flowinfo=htonl(0), sin6_scope_id=0}, 28) = 0
listen(6, 128)                          = 0
ioctl(6, FIONBIO, [1])                  = 0
epoll_ctl(4, EPOLL_CTL_MOD, 6, {EPOLLIN|EPOLLPRI|EPOLLERR|EPOLLHUP|EPOLLET, {u32=14864320, u64=14864320}}) = 0
epoll_wait(4, [{EPOLLIN, {u32=14864152, u64=14864152}}], 128, -1) = 1
```

Here is a diff of them
https://www.diffchecker.com/QWcHVau9

One thing in particular caught my eye. The second parameter to listen (the backlog size) is 128 in my simple example and 0 in the echo_server. It is also 128 in the asio webserver example. Quite frankly I did not think 0 was allowed. I will try and find where in websocketpp I can increase this and see if it helps.

**Comment by tkarls** [comment]
Just read your latest comment (missed it before I posted mine). Ok, If you know 0 to be troublesome as listen backlog I think we have a winner.

Although strange that you say that the echo_server uses the default.

**Comment by tkarls** [comment]
Ok, that was easy to change.

Called 
echo_server.set_listen_backlog(64);

and now it works!

Puew :)
Thanks for your comments. they helped!

Perhaps websocketpp should change its default setting from 0 to something else?

**Comment by zaphoyd** [comment]
originally WebSocket++ used 0. Which some OS' interpret as "use your default" and others interpret as "don't work". I changed it to use the Asio supplied default, which worked reasonably on all the systems that were not working at the time.

It sounds like on your system the Asio default version is wrong. That isn't something I can directly fix in WebSocket++, a ticket on Asio might be useful here.

At minimum what I can do in WebSocket++ is to have some sort of static assert or warning if WS++ determines that Asio is reporting 0 as a default.

**Comment by tkarls** [comment]
Ok I see.

Just doesn't fully understand. In endpoint.cpp the constructor is setting the listen backlog to 0
https://github.com/zaphoyd/websocketpp/blob/378437aecdcb1dfe62096ffd5d944bf1f640ccc3/websocketpp/transport/asio/endpoint.hpp#L94

```
explicit endpoint()
      : m_io_service(NULL)
      , m_external_io_service(false)
      , m_listen_backlog(0)
      , m_reuse_addr(false)
      , m_state(UNINITIALIZED)
    {
        //std::cout << "transport::asio::endpoint constructor" << std::endl;
    }
```

and unless set_listen_backlog I don't see that changing? Or do I misunderstand?

**Comment by tkarls** [comment]
I actually think that this commit is to "blame"

https://github.com/zaphoyd/websocketpp/commit/edb26d7721bd8c8c95f5f29807f274fa5afd7c4e

Before it was checking if backlog was 0 and if so calling listen without arguments causing boost to use a sane default
`void listen(int backlog = socket_base::max_connections)`

When calling the overload with an error parameter there is no equivalent code left.

If you agree, I'm happy to provide a pull request to fix this.

**Comment by maksis** [comment]
Isn't that fixed in https://github.com/zaphoyd/websocketpp/commit/0bb33e4bca4ccc42a36aa2321e4fb97f2562e519 already?

**Comment by tkarls** [comment]
@maksis 
Yea your right. But that commit doesn't seem to be on master? Is it from an open pull request?

Since on master the queue is still 0.
https://github.com/zaphoyd/websocketpp/blob/master/websocketpp/transport/asio/endpoint.hpp#L94

**Comment by tkarls** [comment]
Ok, I see now. The commit is on develop. And will be included in the 0.8 release.

**Comment by zaphoyd** [comment]
Closing this as the issue appears to be resolved (on develop branch at least)
